{
  "schema_version": "ghost.mix-plan/1",
  "summary": "Control persistent low-mid buildup while preserving the kick and bass onset.",
  "confidence": 0.82,
  "assumptions": [
    "The twelve-second capture represents the intended bass section."
  ],
  "operations": [
    {
      "operation": "eq_band",
      "settings": {
        "band_id": "low-mid-control",
        "enabled": true,
        "shape": "bell",
        "frequency_hz": 230.0,
        "gain_db": -2.2,
        "q": 1.1,
        "slope_db_oct": null,
        "channel_mode": "stereo",
        "dynamic": {
          "enabled": true,
          "range_db": -1.5,
          "threshold_db": null
        },
        "rationale": "The low-mid band is materially elevated relative to the synthetic reference.",
        "evidence": [
          "low_mid_db=-21.842",
          "fixture_manifest=excess persistent 230 Hz low-mid energy"
        ]
      }
    },
    {
      "operation": "compressor",
      "settings": {
        "enabled": true,
        "style": "clean",
        "threshold_db": -18.0,
        "ratio": 1.8,
        "knee_db": 8.0,
        "attack_ms": 28.0,
        "release_ms": 150.0,
        "range_db": 2.5,
        "mix_percent": 65.0,
        "output_gain_db": 0.0,
        "rationale": "Stabilize sustained event level without removing the leading transient.",
        "evidence": [
          "crest_factor_db=13.950"
        ]
      }
    }
  ],
  "expected_changes": [
    {
      "metric": "spectrum.bands.low_mid_db",
      "direction": "decrease",
      "maximum_delta": 4.0,
      "unit": "dB"
    },
    {
      "metric": "loudness.crest_factor_db",
      "direction": "decrease",
      "maximum_delta": 2.5,
      "unit": "dB"
    }
  ],
  "cautions": [
    "Confirm the result with level-matched A/B in the full mix."
  ]
}
